2025-03-11 14:36:14 : INFO : (4244 | DIRECTOR) : (IS | IS) : node01 : TM_6014 : Initializing session [s_m_group_exercise] at [Tue Mar 11 14:36:14 2025].
2025-03-11 14:36:14 : INFO : (4244 | DIRECTOR) : (IS | IS) : node01 : TM_6683 : Repository Name: [REP]
2025-03-11 14:36:14 : INFO : (4244 | DIRECTOR) : (IS | IS) : node01 : TM_6684 : Server Name: [IS]
2025-03-11 14:36:14 : INFO : (4244 | DIRECTOR) : (IS | IS) : node01 : TM_6686 : Folder: [Test]
2025-03-11 14:36:14 : INFO : (4244 | DIRECTOR) : (IS | IS) : node01 : TM_6685 : Workflow: [wf_group_exercise] Run Instance Name: [] Run Id: [12]
2025-03-11 14:36:14 : INFO : (4244 | DIRECTOR) : (IS | IS) : node01 : TM_6992 : Operating System Type [NT]
2025-03-11 14:36:14 : INFO : (4244 | DIRECTOR) : (IS | IS) : node01 : TM_6101 : Mapping name: m_group_exercise.
2025-03-11 14:36:14 : INFO : (4244 | DIRECTOR) : (IS | IS) : node01 : TM_6964 : Date format for the Session is [MM/DD/YYYY HH24:MI:SS.US]
2025-03-11 14:36:14 : INFO : (4244 | DIRECTOR) : (IS | IS) : node01 : TM_6708 : Using configuration property [EnableDataEncryption,no]
2025-03-11 14:36:14 : INFO : (4244 | DIRECTOR) : (IS | IS) : node01 : TM_6708 : Using configuration property [StoreHAPersistenceInDB,no]
2025-03-11 14:36:14 : INFO : (4244 | DIRECTOR) : (IS | IS) : node01 : TM_6703 : Session [s_m_group_exercise] is run by 64-bit Integration Service  [node01], version [10.5.2], build [0322].
2025-03-11 14:36:14 : INFO : (4244 | MANAGER) : (IS | IS) : node01 : PETL_24091 : Thread [MANAGER] has the ID [1].
2025-03-11 14:36:14 : INFO : (4244 | MANAGER) : (IS | IS) : node01 : PETL_24058 : Running Partition Group [1].
2025-03-11 14:36:14 : INFO : (4244 | MANAGER) : (IS | IS) : node01 : PETL_24000 : Parallel Pipeline Engine initializing.
2025-03-11 14:36:14 : INFO : (4244 | MONITOR) : (IS | IS) : node01 : PETL_24091 : Thread [MONITOR] has the ID [2].
2025-03-11 14:36:14 : INFO : (4244 | MANAGER) : (IS | IS) : node01 : PETL_24001 : Parallel Pipeline Engine running.
2025-03-11 14:36:14 : INFO : (4244 | MANAGER) : (IS | IS) : node01 : PETL_24003 : Initializing session run.
2025-03-11 14:36:14 : INFO : (4244 | MAPPING) : (IS | IS) : node01 : PETL_24091 : Thread [MAPPING] has the ID [3].
2025-03-11 14:36:14 : INFO : (4244 | MAPPING) : (IS | IS) : node01 : CMN_1569 : Server Mode: [ASCII]
2025-03-11 14:36:14 : INFO : (4244 | MAPPING) : (IS | IS) : node01 : CMN_1570 : Server Code page: [MS Windows Latin 1 (ANSI), superset of Latin1]
2025-03-11 14:36:14 : INFO : (4244 | MAPPING) : (IS | IS) : node01 : TM_6151 : The session sort order is [Binary].
2025-03-11 14:36:14 : INFO : (4244 | MAPPING) : (IS | IS) : node01 : CMN_65110 : Current Timezone:[UTC +5:30]
2025-03-11 14:36:14 : INFO : (4244 | MAPPING) : (IS | IS) : node01 : CMN_65112 : Current Process ID:[4244]
2025-03-11 14:36:14 : INFO : (4244 | MAPPING) : (IS | IS) : node01 : TM_6156 : Using low precision processing.
2025-03-11 14:36:14 : INFO : (4244 | MAPPING) : (IS | IS) : node01 : TM_6180 : Deadlock retry logic will not be implemented.
2025-03-11 14:36:14 : INFO : (4244 | MAPPING) : (IS | IS) : node01 : TM_6187 : Session target-based commit interval is [10000].
2025-03-11 14:36:14 : INFO : (4244 | MAPPING) : (IS | IS) : node01 : TM_6307 : DTM error log disabled. 
2025-03-11 14:36:14 : INFO : (4244 | MAPPING) : (IS | IS) : node01 : TE_7022 : TShmWriter: Initialized
2025-03-11 14:36:14 : INFO : (4244 | MAPPING) : (IS | IS) : node01 : DBG_21693 : SRTTRANS: Cache size for partition [1] = [536870912]
2025-03-11 14:36:14 : INFO : (4244 | MAPPING) : (IS | IS) : node01 : SORT_40419 : For Transformation [SRTTRANS], memory used is [536870912] bytes and row size is 100 bytes.
2025-03-11 14:36:14 : DEBUG : (4244 | MAPPING) : (IS | IS) : node01 : TE_7004 : Transformation Parse Warning [ltrim(rtrim(GROUP_ID))]; transformation continues...
2025-03-11 14:36:14 : DEBUG : (4244 | MAPPING) : (IS | IS) : node01 : TE_7004 : Transformation Parse Warning [<<PM Parse Warning>> [RTRIM]: operand converted to a string
... ltrim(rtrim(>>>>GROUP_ID<<<<))]; transformation continues...
2025-03-11 14:36:14 : INFO : (4244 | MAPPING) : (IS | IS) : node01 : TM_6007 : DTM initialized successfully for session [s_m_group_exercise]
2025-03-11 14:36:14 : INFO : (4244 | DIRECTOR) : (IS | IS) : node01 : PETL_24033 : All DTM Connection Info: [<NONE>].
2025-03-11 14:36:14 : INFO : (4244 | MANAGER) : (IS | IS) : node01 : PETL_24004 : PETL_24004 Starting pre-session tasks. : (Tue Mar 11 14:36:14 2025)
2025-03-11 14:36:14 : INFO : (4244 | PRE-SESS) : (IS | IS) : node01 : PETL_24091 : Thread [PRE-SESS] has the ID [4].
2025-03-11 14:36:14 : INFO : (4244 | MANAGER) : (IS | IS) : node01 : PETL_24027 : PETL_24027 Pre-session task completed successfully. : (Tue Mar 11 14:36:14 2025)
2025-03-11 14:36:14 : INFO : (4244 | DIRECTOR) : (IS | IS) : node01 : PETL_24006 : Starting data movement.
2025-03-11 14:36:14 : INFO : (4244 | MAPPING) : (IS | IS) : node01 : TM_6660 : Total Buffer Pool size is 1829472 bytes and Block size is 65536 bytes.
2025-03-11 14:36:14 : INFO : (4244 | READER_1_1_1) : (IS | IS) : node01 : PETL_24091 : Thread [READER_1_1_1] has the ID [5].
2025-03-11 14:36:14 : INFO : (4244 | READER_1_1_1) : (IS | IS) : node01 : DBG_21437 : Reader: Source is a file-based source.
2025-03-11 14:36:14 : INFO : (4244 | READER_1_1_1) : (IS | IS) : node01 : FR_3118 : source [SQ_Group_Fixed] code page: [MS Windows Latin 1 (ANSI), superset of Latin1]
2025-03-11 14:36:14 : INFO : (4244 | READER_1_1_1) : (IS | IS) : node01 : BLKR_16003 : Initialization completed successfully.
2025-03-11 14:36:14 : INFO : (4244 | TRANSF_1_1_1) : (IS | IS) : node01 : PETL_24091 : Thread [TRANSF_1_1_1] has the ID [6].
2025-03-11 14:36:14 : INFO : (4244 | READER_1_2_1) : (IS | IS) : node01 : PETL_24091 : Thread [READER_1_2_1] has the ID [7].
2025-03-11 14:36:14 : INFO : (4244 | READER_1_2_1) : (IS | IS) : node01 : DBG_21437 : Reader: Source is a file-based source.
2025-03-11 14:36:14 : INFO : (4244 | READER_1_2_1) : (IS | IS) : node01 : FR_3118 : source [SQ_Group_Comma] code page: [MS Windows Latin 1 (ANSI), superset of Latin1]
2025-03-11 14:36:14 : INFO : (4244 | READER_1_2_1) : (IS | IS) : node01 : FR_3071 : Maximum Line sequential buffer length is 1026.
2025-03-11 14:36:14 : INFO : (4244 | READER_1_2_1) : (IS | IS) : node01 : BLKR_16003 : Initialization completed successfully.
2025-03-11 14:36:14 : INFO : (4244 | TRANSF_1_2_1) : (IS | IS) : node01 : PETL_24091 : Thread [TRANSF_1_2_1] has the ID [8].
2025-03-11 14:36:14 : INFO : (4244 | WRITER_1_*_1) : (IS | IS) : node01 : PETL_24091 : Thread [WRITER_1_*_1] has the ID [9].
2025-03-11 14:36:14 : INFO : (4244 | WRITER_1_*_1) : (IS | IS) : node01 : WRT_8147 : Writer: Target is Database [orcl], Type [Oracle], User [system], Bulk Mode [OFF]
2025-03-11 14:36:15 : INFO : (4244 | WRITER_1_*_1) : (IS | IS) : node01 : WRT_8397 : Appending output data to file [C:\Informatica\10.5.2\server\infa_shared\BadFiles\group_test1.bad] (initial size [282]).
2025-03-11 14:36:15 : INFO : (4244 | WRITER_1_*_1) : (IS | IS) : node01 : WRT_8124 : Target Table GROUP_TEST :SQL INSERT statement:
INSERT INTO GROUP_TEST(GRP_SK,GROUP_ID,GROUP_NAME,EFF_DT,TERM_DT,STREET,CITY,STATE,ZIP)  VALUES ( ?, ?, ?, ?, ?, ?, ?, ?, ?) 
2025-03-11 14:36:15 : INFO : (4244 | WRITER_1_*_1) : (IS | IS) : node01 : WRT_8124 : Target Table GROUP_TEST :SQL UPDATE statement:
UPDATE GROUP_TEST SET GRP_SK = ?, GROUP_NAME = ?, EFF_DT = ?, TERM_DT = ?, STREET = ?, CITY = ?, STATE = ?, ZIP = ? WHERE GROUP_ID = ?
2025-03-11 14:36:15 : INFO : (4244 | WRITER_1_*_1) : (IS | IS) : node01 : WRT_8124 : Target Table GROUP_TEST :SQL DELETE statement:
DELETE FROM GROUP_TEST WHERE GROUP_ID = ?
2025-03-11 14:36:15 : INFO : (4244 | WRITER_1_*_1) : (IS | IS) : node01 : WRT_8270 : Target connection group #1 consists of target(s) [GROUP_TEST]
2025-03-11 14:36:15 : INFO : (4244 | WRITER_1_*_1) : (IS | IS) : node01 : WRT_8003 : Writer initialization complete.
2025-03-11 14:36:15 : INFO : (4244 | READER_1_1_1) : (IS | IS) : node01 : BLKR_16007 : Reader run started.
2025-03-11 14:36:15 : INFO : (4244 | READER_1_2_1) : (IS | IS) : node01 : BLKR_16007 : Reader run started.
2025-03-11 14:36:15 : INFO : (4244 | WRITER_1_*_1) : (IS | IS) : node01 : WRT_8005 : Writer run started.
2025-03-11 14:36:15 : INFO : (4244 | WRITER_1_*_1) : (IS | IS) : node01 : WRT_8158 : 

*****START LOAD SESSION*****

Load Start Time: Tue Mar 11 14:36:15 2025

Target tables:

     GROUP_TEST


2025-03-11 14:36:15 : INFO : (4244 | READER_1_1_1) : (IS | IS) : node01 : DBG_21430 : DBG_21430 Reading data from input source file [C:\Users\Administrator\Downloads\Group_Fixed.txt] : (Tue Mar 11 14:36:15 2025)
2025-03-11 14:36:15 : INFO : (4244 | READER_1_2_1) : (IS | IS) : node01 : FR_3076 : Skipped over [1] lines.
2025-03-11 14:36:15 : INFO : (4244 | READER_1_2_1) : (IS | IS) : node01 : DBG_21430 : DBG_21430 Reading data from input source file [C:\Users\Administrator\Downloads\Group_Comma.csv] : (Tue Mar 11 14:36:15 2025)
2025-03-11 14:36:15 : INFO : (4244 | READER_1_2_1) : (IS | IS) : node01 : BLKR_16019 : Read [5] rows, read [0] error rows for source table [Group_Comma] instance name [Group_Comma]
2025-03-11 14:36:15 : INFO : (4244 | READER_1_1_1) : (IS | IS) : node01 : BLKR_16019 : Read [7] rows, read [0] error rows for source table [Group_Fixed] instance name [Group_Fixed]
2025-03-11 14:36:15 : INFO : (4244 | READER_1_1_1) : (IS | IS) : node01 : BLKR_16008 : Reader run completed.
2025-03-11 14:36:15 : INFO : (4244 | READER_1_2_1) : (IS | IS) : node01 : BLKR_16008 : Reader run completed.
2025-03-11 14:36:15 : INFO : (4244 | TRANSF_1_2_1) : (IS | IS) : node01 : SORT_40420 : SORT_40420 Start of input for Transformation [SRTTRANS]. : (Tue Mar 11 14:36:15 2025)
2025-03-11 14:36:15 : INFO : (4244 | TRANSF_1_2_1) : (IS | IS) : node01 : DBG_21216 : Finished transformations for Source Qualifier [SQ_Group_Comma]. Total errors [0] 
2025-03-11 14:36:15 : INFO : (4244 | TRANSF_1_1_1) : (IS | IS) : node01 : SORT_40421 : SORT_40421 End of input for Transformation [SRTTRANS]. : (Tue Mar 11 14:36:15 2025)
2025-03-11 14:36:15 : INFO : (4244 | TRANSF_1_1_1) : (IS | IS) : node01 : SORT_40422 : SORT_40422 End of output from Sorter Transformation [SRTTRANS]. Processed 12 rows (1124 input bytes; 0 temp I/O bytes). : (Tue Mar 11 14:36:15 2025)
2025-03-11 14:36:15 : INFO : (4244 | TRANSF_1_1_1) : (IS | IS) : node01 : SORT_40423 : SORT_40423 End of sort for Sorter Transformation [SRTTRANS]. : (Tue Mar 11 14:36:15 2025)
2025-03-11 14:36:15 : INFO : (4244 | TRANSF_1_1_1) : (IS | IS) : node01 : DBG_21216 : Finished transformations for Source Qualifier [SQ_Group_Fixed]. Total errors [0] 
2025-03-11 14:36:15 : INFO : (4244 | WRITER_1_*_1) : (IS | IS) : node01 : WRT_8167 : Start loading table [GROUP_TEST] at: Tue Mar 11 14:36:15 2025
2025-03-11 14:36:15 : ERROR : (4244 | WRITER_1_*_1) : (IS | IS) : node01 : WRT_8229 : Database errors occurred: 
ORA-00001: unique constraint (SYSTEM.SYS_C0011579) violated

Database driver error...
Function Name : Execute
SQL Stmt : INSERT INTO GROUP_TEST(GRP_SK,GROUP_ID,GROUP_NAME,EFF_DT,TERM_DT,STREET,CITY,STATE,ZIP)  VALUES ( ?, ?, ?, ?, ?, ?, ?, ?, ?) 
Database driver error...
Function Name : Execute Multiple
SQL Stmt : INSERT INTO GROUP_TEST(GRP_SK,GROUP_ID,GROUP_NAME,EFF_DT,TERM_DT,STREET,CITY,STATE,ZIP)  VALUES ( ?, ?, ?, ?, ?, ?, ?, ?, ?) 
2025-03-11 14:36:15 : ERROR : (4244 | WRITER_1_*_1) : (IS | IS) : node01 : WRT_8425 : ERROR: Writer execution failed.
2025-03-11 14:36:15 : ERROR : (4244 | WRITER_1_*_1) : (IS | IS) : node01 : WRT_8114 : 
Row # [1] in bad file

2025-03-11 14:36:15 : INFO : (4244 | WRITER_1_*_1) : (IS | IS) : node01 : CMN_1053 : : Rowdata: ( RowType=0(insert) Src Rowid=3 Targ Rowid=3
  GRP_SK (GRP_SK:Double:): "75.00000000000000"
  GROUP_ID (GROUP_ID:Char.8:): "12346"
  GROUP_NAME (GROUP_NAME:Char.30:): "XYZ INC"
  EFF_DT (EFF_DT:Date:): "09/01/2013 00:00:00.000000000"
  TERM_DT (TERM_DT:Date:): "12/31/2015 00:00:00.000000000"
  STREET (STREET:Char.35:): "SECOND ST"
  CITY (CITY:Char.15:): "ROCHESTER"
  STATE (STATE:Char.20:): "NEW YORK"
  ZIP (ZIP:Double:): "60124.00000000000"
)

2025-03-11 14:36:15 : ERROR : (4244 | WRITER_1_*_1) : (IS | IS) : node01 : WRT_8229 : Database errors occurred: 
ORA-00001: unique constraint (SYSTEM.SYS_C0011579) violated

Database driver error...
Function Name : Execute
SQL Stmt : INSERT INTO GROUP_TEST(GRP_SK,GROUP_ID,GROUP_NAME,EFF_DT,TERM_DT,STREET,CITY,STATE,ZIP)  VALUES ( ?, ?, ?, ?, ?, ?, ?, ?, ?) 
Database driver error...
Function Name : Execute Multiple
SQL Stmt : INSERT INTO GROUP_TEST(GRP_SK,GROUP_ID,GROUP_NAME,EFF_DT,TERM_DT,STREET,CITY,STATE,ZIP)  VALUES ( ?, ?, ?, ?, ?, ?, ?, ?, ?) 
2025-03-11 14:36:15 : ERROR : (4244 | WRITER_1_*_1) : (IS | IS) : node01 : WRT_8425 : ERROR: Writer execution failed.
2025-03-11 14:36:15 : ERROR : (4244 | WRITER_1_*_1) : (IS | IS) : node01 : WRT_8114 : 
Row # [2] in bad file

2025-03-11 14:36:15 : INFO : (4244 | WRITER_1_*_1) : (IS | IS) : node01 : CMN_1053 : : Rowdata: ( RowType=0(insert) Src Rowid=5 Targ Rowid=5
  GRP_SK (GRP_SK:Double:): "77.00000000000000"
  GROUP_ID (GROUP_ID:Char.8:): "12347"
  GROUP_NAME (GROUP_NAME:Char.30:): "THINK INC"
  EFF_DT (EFF_DT:Date:): "06/01/2013 00:00:00.000000000"
  TERM_DT (TERM_DT:Date:): "12/31/2016 00:00:00.000000000"
  STREET (STREET:Char.35:): "THIRD ST"
  CITY (CITY:Char.15:): "BUFFALO"
  STATE (STATE:Char.20:): "NEW YORK"
  ZIP (ZIP:Double:): "60125.00000000000"
)

2025-03-11 14:36:15 : ERROR : (4244 | WRITER_1_*_1) : (IS | IS) : node01 : WRT_8229 : Database errors occurred: 
ORA-00001: unique constraint (SYSTEM.SYS_C0011579) violated

Database driver error...
Function Name : Execute
SQL Stmt : INSERT INTO GROUP_TEST(GRP_SK,GROUP_ID,GROUP_NAME,EFF_DT,TERM_DT,STREET,CITY,STATE,ZIP)  VALUES ( ?, ?, ?, ?, ?, ?, ?, ?, ?) 
Database driver error...
Function Name : Execute Multiple
SQL Stmt : INSERT INTO GROUP_TEST(GRP_SK,GROUP_ID,GROUP_NAME,EFF_DT,TERM_DT,STREET,CITY,STATE,ZIP)  VALUES ( ?, ?, ?, ?, ?, ?, ?, ?, ?) 
2025-03-11 14:36:15 : ERROR : (4244 | WRITER_1_*_1) : (IS | IS) : node01 : WRT_8425 : ERROR: Writer execution failed.
2025-03-11 14:36:15 : ERROR : (4244 | WRITER_1_*_1) : (IS | IS) : node01 : WRT_8114 : 
Row # [3] in bad file

2025-03-11 14:36:15 : INFO : (4244 | WRITER_1_*_1) : (IS | IS) : node01 : CMN_1053 : : Rowdata: ( RowType=0(insert) Src Rowid=7 Targ Rowid=7
  GRP_SK (GRP_SK:Double:): "79.00000000000000"
  GROUP_ID (GROUP_ID:Char.8:): "12348"
  GROUP_NAME (GROUP_NAME:Char.30:): "TANK CORP"
  EFF_DT (EFF_DT:Date:): "03/01/2013 00:00:00.000000000"
  TERM_DT (TERM_DT:Date:): "12/31/2017 00:00:00.000000000"
  STREET (STREET:Char.35:): "FOURTH ST"
  CITY (CITY:Char.15:): "KENTUCKY"
  STATE (STATE:Char.20:): "NEW YORK"
  ZIP (ZIP:Double:): "60126.00000000000"
)

2025-03-11 14:36:15 : ERROR : (4244 | WRITER_1_*_1) : (IS | IS) : node01 : WRT_8229 : Database errors occurred: 
ORA-00001: unique constraint (SYSTEM.SYS_C0011579) violated

Database driver error...
Function Name : Execute
SQL Stmt : INSERT INTO GROUP_TEST(GRP_SK,GROUP_ID,GROUP_NAME,EFF_DT,TERM_DT,STREET,CITY,STATE,ZIP)  VALUES ( ?, ?, ?, ?, ?, ?, ?, ?, ?) 
Database driver error...
Function Name : Execute Multiple
SQL Stmt : INSERT INTO GROUP_TEST(GRP_SK,GROUP_ID,GROUP_NAME,EFF_DT,TERM_DT,STREET,CITY,STATE,ZIP)  VALUES ( ?, ?, ?, ?, ?, ?, ?, ?, ?) 
2025-03-11 14:36:15 : ERROR : (4244 | WRITER_1_*_1) : (IS | IS) : node01 : WRT_8425 : ERROR: Writer execution failed.
2025-03-11 14:36:15 : ERROR : (4244 | WRITER_1_*_1) : (IS | IS) : node01 : WRT_8114 : 
Row # [4] in bad file

2025-03-11 14:36:15 : INFO : (4244 | WRITER_1_*_1) : (IS | IS) : node01 : CMN_1053 : : Rowdata: ( RowType=0(insert) Src Rowid=9 Targ Rowid=9
  GRP_SK (GRP_SK:Double:): "81.00000000000000"
  GROUP_ID (GROUP_ID:Char.8:): "12349"
  GROUP_NAME (GROUP_NAME:Char.30:): "BUZ ASSC"
  EFF_DT (EFF_DT:Date:): "12/01/2012 00:00:00.000000000"
  TERM_DT (TERM_DT:Date:): "12/31/2014 00:00:00.000000000"
  STREET (STREET:Char.35:): "CROSS ST"
  CITY (CITY:Char.15:): "CHICAGO"
  STATE (STATE:Char.20:): "ILLINOIS"
  ZIP (ZIP:Double:): "60127.00000000000"
)

2025-03-11 14:36:15 : INFO : (4244 | WRITER_1_*_1) : (IS | IS) : node01 : WRT_8168 : End loading table [GROUP_TEST] at: Tue Mar 11 14:36:15 2025
2025-03-11 14:36:15 : INFO : (4244 | WRITER_1_*_1) : (IS | IS) : node01 : WRT_8141 : 
Commit on end-of-data  Tue Mar 11 14:36:15 2025
===================================================

WRT_8036 Target: GROUP_TEST (Instance Name: [GROUP_TEST])
WRT_8038 Inserted rows - Requested: 12         Applied: 8          Rejected: 4          Affected: 8         

2025-03-11 14:36:15 : INFO : (4244 | WRITER_1_*_1) : (IS | IS) : node01 : WRT_8035 : Load complete time: Tue Mar 11 14:36:15 2025

LOAD SUMMARY
============

WRT_8036 Target: GROUP_TEST (Instance Name: [GROUP_TEST])
WRT_8038 Inserted rows - Requested: 12         Applied: 8          Rejected: 4          Affected: 8         


2025-03-11 14:36:15 : INFO : (4244 | WRITER_1_*_1) : (IS | IS) : node01 : WRT_8043 : *****END LOAD SESSION*****
2025-03-11 14:36:15 : INFO : (4244 | WRITER_1_*_1) : (IS | IS) : node01 : WRT_8006 : Writer run completed.
2025-03-11 14:36:15 : INFO : (4244 | MANAGER) : (IS | IS) : node01 : PETL_24031 : 
***** RUN INFO FOR TGT LOAD ORDER GROUP [1], CONCURRENT SET [1] *****
Thread [READER_1_1_1] created for [the read stage] of partition point [SQ_Group_Fixed] has completed. The total run time was insufficient for any meaningful statistics.
Thread [TRANSF_1_1_1] created for [the transformation stage] of partition point [SQ_Group_Fixed] has completed. The total run time was insufficient for any meaningful statistics.
Thread [READER_1_2_1] created for [the read stage] of partition point [SQ_Group_Comma] has completed. The total run time was insufficient for any meaningful statistics.
Thread [TRANSF_1_2_1] created for [the transformation stage] of partition point [SQ_Group_Comma] has completed. The total run time was insufficient for any meaningful statistics.
Thread [WRITER_1_*_1] created for [the write stage] of partition point [GROUP_TEST] has completed. The total run time was insufficient for any meaningful statistics.

2025-03-11 14:36:15 : INFO : (4244 | MANAGER) : (IS | IS) : node01 : PETL_24005 : PETL_24005 Starting post-session tasks. : (Tue Mar 11 14:36:15 2025)
2025-03-11 14:36:15 : INFO : (4244 | POST-SESS) : (IS | IS) : node01 : PETL_24091 : Thread [POST-SESS] has the ID [10].
2025-03-11 14:36:15 : INFO : (4244 | MANAGER) : (IS | IS) : node01 : PETL_24029 : PETL_24029 Post-session task completed successfully. : (Tue Mar 11 14:36:15 2025)
2025-03-11 14:36:15 : INFO : (4244 | MAPPING) : (IS | IS) : node01 : TM_6018 : The session completed with [0] row transformation errors. 
2025-03-11 14:36:15 : INFO : (4244 | MANAGER) : (IS | IS) : node01 : PETL_24002 : Parallel Pipeline Engine finished.
2025-03-11 14:36:15 : INFO : (4244 | DIRECTOR) : (IS | IS) : node01 : PETL_24012 : Session run completed successfully.
2025-03-11 14:36:16 : INFO : (4244 | DIRECTOR) : (IS | IS) : node01 : TM_6022 : 

SESSION LOAD SUMMARY
================================================

2025-03-11 14:36:16 : INFO : (4244 | DIRECTOR) : (IS | IS) : node01 : TM_6252 : Source Load Summary.
2025-03-11 14:36:16 : INFO : (4244 | DIRECTOR) : (IS | IS) : node01 : CMN_1740 : Table: [SQ_Group_Fixed] (Instance Name: [SQ_Group_Fixed])
	 Output Rows [7], Affected Rows [7], Applied Rows [7], Rejected Rows [0]
2025-03-11 14:36:16 : INFO : (4244 | DIRECTOR) : (IS | IS) : node01 : CMN_1740 : Table: [SQ_Group_Comma] (Instance Name: [SQ_Group_Comma])
	 Output Rows [5], Affected Rows [5], Applied Rows [5], Rejected Rows [0]
2025-03-11 14:36:16 : INFO : (4244 | DIRECTOR) : (IS | IS) : node01 : TM_6253 : Target Load Summary.
2025-03-11 14:36:16 : INFO : (4244 | DIRECTOR) : (IS | IS) : node01 : CMN_1740 : Table: [GROUP_TEST] (Instance Name: [GROUP_TEST])
	 Output Rows [8], Affected Rows [8], Applied Rows [8], Rejected Rows [4]
2025-03-11 14:36:16 : INFO : (4244 | DIRECTOR) : (IS | IS) : node01 : TM_6023 : 
===================================================

2025-03-11 14:36:16 : INFO : (4244 | DIRECTOR) : (IS | IS) : node01 : TM_6020 : Session [s_m_group_exercise] completed at [Tue Mar 11 14:36:15 2025].
